{
  "program_code": "runtime_envelope_completion_program",
  "schema_version": "draft-backlog-count-snapshot-v1",
  "schema_path": "tmp/github-publish/backlog_contract/draft_backlog_count_snapshot_v1.schema.json",
  "policy_refs": [
    "tmp/planning/backlog_publication/backlog_publication_policy.json",
    "tmp/planning/backlog_publication/backlog_publication_policy.md"
  ],
  "generated_at": "2026-03-31T00:14:47.483263+00:00",
  "repo_facts": {
    "package_scripts": 144,
    "check_py_files": 82,
    "test_check_py_files": 0,
    "m2xx_refs_in_native_src": 0,
    "tracked_ll_files": 76,
    "tracked_stub_ll_files": 0,
    "prototype_semantic_surface_present": false
  },
  "milestone_count": 6,
  "issue_count": 63,
  "issue_counts_by_milestone": {
    "M319": 11,
    "M320": 11,
    "M321": 10,
    "M322": 11,
    "M323": 11,
    "M324": 9
  },
  "prerequisite_sequence": "M317 -> {M313, M314, M315 overlap} -> M316 -> M318",
  "recommended_sequence": "M317 -> {M313, M314, M315 overlap} -> M316 -> M318 -> M319 -> M320 -> M321 -> M322 -> M323 -> M324",
  "parallel_milestone_groups": []
}
